{
  "schema_version": "myis.p2-evaluator-compatibility.v1",
  "compatibility_id": "p1-accepted-to-p2-r1-primary-v2-progress-v1",
  "classification": "A_byte_hash_drift_scientifically_identical_semantics",
  "baseline": {
    "uri": "src/myis_research/kernel/p1.py",
    "source_commit": "947d9a132f2272774dcd8b4ab6e831e0734ec7d3",
    "evaluator_sha256": "6dd3b1d203304c3e8ef9e1aa049b82ae99ce60c1cd3af78cf99f76874db6346d",
    "accepted_receipt_uri": "campaigns/scope-autoindex-v1/evidence/dapfam-p1-fulltext-c058a3aa7357c782.receipt.json",
    "accepted_receipt_sha256": "e9c0f70cc3fdcd15386c448faa7ae1bc00679dcf3e0c78618e2aa1ae7024f8a3"
  },
  "current": {
    "uri": "src/myis_research/kernel/p1.py",
    "revision_policy": "request_execution_source_commit",
    "evaluator_sha256": "018149dd2a0e62ed95b86534281ef53801329ee8270d8936504803cf996285dd"
  },
  "allowed_difference": {
    "optional_parameter": "progress_sink",
    "callback_sites": 2,
    "scientific_outputs_affected": false,
    "raising_callback_behavior": "fail_before_authoritative_result"
  },
  "proof": {
    "source_diff_sha256": "50976ed8f885a4acd073340467fdc95fcaf13132a59006aa5fc56d01a2fc7336",
    "normalized_ast_sha256": "5c8c662f054b8c35e1369c2be0390219bcbf088b3b67dcf5e08d040ed75541c8",
    "differential_case_count": 4,
    "differential_proof_sha256": "b5513848bf86f03fd1c4a26a8828a04bfd05bb1e50840076805de3100900eb6b",
    "independent_verification": "runtime_reproduction_required",
    "verification_test_uri": "tests/test_p2_preflight_v2.py"
  },
  "claim_boundary": "P1 evaluator scientific outputs only; no P2 result or baseline reproduction claim",
  "compatibility_sha256": "f459a54c598d15f3d6617471ff0a524b3324ab7262b7ecc49fbff812f150c19f"
}
